time,team_name,slogan,observation,challenge_definition,product_introduction,team_introduction,self_question,self_answer,link1,link2,agree,name1,role1,name2,role2,name3,role3,name4,role4,name5,role5,name6,role6,folder_name,field,team_id,link1_name,link2_name
2017/2/14 下午 10:05:50,家攬,"專門為移工舉辦一日遊的組織，
期許能「像家一樣攬著他們」","每當我們假日來到台北車站大廳，總是可以看到一群東南亞籍移工在這裡與朋友聊天、吃飯、約會，在這裡他們能擺脫平日繁瑣重複的工作。

但是台灣人往往覺得他們為當地製造髒亂、吵鬧並避之唯恐不及，這些歧視與刻板印象導致兩個族群間的不友善與不信任，更加使得移工社群的封閉排外，這樣的現象不是一個自詡多元友善的國家所樂見。

因此我們在做過使用者訪談之後，發現了他們的旅遊需求尚未滿足，這是此現象需要被解決之因。",我們發現，真正的問題在於我們要滿足移工在異鄉的旅遊需求。,我們最終選擇了針對東南亞移工的客製化一日遊服務。因為首先，藉由讓互相認識的朋友聯絡感情、不認識的人成為朋友，旅行團能提供歸屬感；再來，我們會事先安排好適當的景點、交通工具、會講印尼語的導遊，移工可以完全不用煩惱旅遊資訊不足、語言不通的問題，盡情遊玩放鬆；最後，藉由客製化的行程，我們會尊重移工的宗教信仰，訂購或推薦適合的餐點，並帶領他們循序漸進了解台灣的地方文化，使得他們能更加融入這塊土地。我們的核心價值就是站在移工的角度為他們規劃最適當的行程。,"我們團隊的特質是熱情、積極、開放，我們希望夠像「家」一樣接納、
包容來自各地的東南亞移工。",參賽至今最大的挑戰？,"最大的挑戰是融入移工社群並宣傳我們的旅遊服務，幾個週末下來到台北車站的推廣相當使我們氣餒，因為移工對台灣人的不信任，我們往往必須與他們深聊許久才能使他們對我們的服務感興趣，宣傳日的一個下午下來我們往往未能擁有大量的接觸人數，
但儘管如此，我們還是透過粉專抽獎等方式持續努力並在後續的宣傳上愈來愈順手。",https://www.facebook.com/Jalan-272525176497172/?fref=ts,,是，全部成員皆同意公開。,李逸婕,隊長,馮曉雯,人力資源,邱淇銘,財務,陳屏瑋,企劃,,,,,https://drive.google.com/drive/folders/0B57moi65qDk8SlFlWHVPZlpWLU0?usp=sharing,sy,sy_70,粉絲專頁,
2017/2/15 下午 3:54:22,SEA時刻,Your guide of Taiwan,根據勞動部資料，現今移工人數大約60萬人，每當放假時，他們總會出門去透透氣就像當兵一樣。相信大家周末在搭區間車時都會覺得外勞特別多，或者是搭公車時被外勞問路的經驗，他們就跟我們一樣也是有交通運輸的需求，因此我們便從這方面著手，希望以此為基礎，往後可以提供他們全面的資訊。,我們發現，針對移工的網路服務相當的缺乏。,我們現在提供了台鐵時刻表的查詢以及台北、新北的公車動態。希望移工放假時的時間規劃可以更方便，提早得知車班還有多久才會到達，而不用急忙趕到車站。,團隊成員來自不同領域，卻對移工議題抱持相同的理念與興趣。,團隊近期計畫？,增加團隊成員。,https://www.facebook.com/GuideofTW/,,否，僅部分成員同意公開。,Matt,,Krach,,Lisa,,,,,,,,https://www.dropbox.com/s/uffwctnz3rm7suf/SEA%E6%99%82%E5%88%BB.zip?dl=0,sy,sy_09,粉絲專頁,
2017/2/15 下午 4:12:18,天台聚落,透明化居住空間的環境資訊,颱風天都會停水，但住戶不知道水塔還有多少水，所以要把家中全部的水桶都拿來備水，甚至最後發現其實水塔的蓄水量是夠的。又或者經常忘了清洗水塔，等到水流明顯變黃才請專業公司過來清潔，看到水塔內部的狀況才知道自己的水質有多髒，過髒的進水容易造成濾水器的壽命減短。,我們發現，真正的問題在於想要改善一件事情，並需能先觀察、感受、瞭解到真實的情況。,"將感測器整合到現有的水塔蓋，讓住戶只要更換水塔蓋就可以得知水塔內部的狀況，不論是透天/公寓/大樓都可以使用。透過裝設在水塔蓋上的感測裝置，進而實時分析水資源之各項指標，如水量等。 

主要效益在於此方法可即時監測所在區域或建物之水資源變化趨勢，透過低成本之建築設備整合與介面設計，令使用者可即時獲得第一手之生活環境相關訊息，並採取相對應之解決方案，提高生活品質與環境知識。","由5位不同專業背景組成，互為同事、學長學弟與兵役同袍，
對彼此個性熟悉，希望大家共同產出改變社會的產品。",參賽初衷？,"參加台大創創挑戰賽，對我們而言感覺比較像是一種創業教育，而非競賽。
團隊夥伴都有創業的想法，但想法不能只是想法，套用Lean startup的概念，
剛好將這次參賽當作驗證，也因為主辦單位的用心讓我們收穫許多。",,,是，全部成員皆同意公開。,周傳文,領域專家,張源炘,工程師,鍾易峻,工程師,賴姵怡,設計師,孟慶龍,設計師,任衍儒,設計師,https://drive.google.com/open?id=0ByI-Qt2lshKGSE94WjZuelc4WHM,et,et_60,,
2017/2/15 下午 11:44:49,火柴青年,"只要勇敢踏出第一步，
就有點燃夢想的機會","經過八百份有效問卷調查，有九成的大學生想過去國外進行交換計畫，但每年成功的人數卻只佔總比例的百分之三，有高達百分之八十七的轉換失敗率。

經費不足、成績不符門檻以及學涯安排規劃是學生們三個主要考量點，但有許多的資訊其實並沒有經由國際事務處傳達完整，許多學長姐的交換經驗也沒有良好的傳遞給學弟妹。",我們發現，最大的問題在於學生的自我設限以及身在體制下的無力感。,"火柴青年是一個大學生出國計畫的加速器，透過與學校、教育部、企業和學生之間的合作，推動更多學生能夠跨出熟悉已久的環境，在國外尋找更多的突破、思考自己與世界的關係。

透過國際事務處串連，我們希望開放各校的交換學生經驗、優化申請交換的流程，協助學生找到適合自己的交換計畫。

我們推動更多學生出國探索並帶回國外的經驗，為台灣的體制及環境進行有效率的突破。","合作夥伴遍及不同大學及專長，
團隊的共同理念是希望用一種貼近學生的角度，
進行有創意、實驗性的嘗試。",參賽至今最大被質疑點？,許多人問我們商業模式是否可行，要怎麼賺到錢？我們採取不同階段漸進式的商業模式，剛開始與廣告、學校、海外企業合作，後面的部分以有價值的數據和異業合作為目標。,https://www.facebook.com/taiwanmatcher/?ref=bookmarks,,是，全部成員皆同意公開。,張文飛,"設計師
企劃製作
公關",羅立群,"活動行銷
文案設計",,,,,,,,,https://drive.google.com/drive/folders/0Bwtl-S7H_Bm7UTQzNHZNblpzQ1k?usp=sharing,sy,sy_64,粉絲專頁,
2017/2/16 上午 1:00:02,微思維斯,"研發新型態的知覺刺激，
提升情侶之間的親密體驗","情慾為人的基本需求，觀察生活中情侶或伴侶間的互動，發現情慾仍是禁忌議題，大眾對親密關係往往害羞不知如何溝通，也因如此，有些女性並不理解自己的身體，認為滿足男性需求就可以提升親密關係，但男性其實也想了解女性想法。微思團隊從實地訪談與研究發現男女對於情慾需求並不相同，女性較男性為細膩也更重視前戲。

如何提升伴侶之間的親密互動，如何一起追求愉悅？微思希望用優雅的設計來解決「被隱藏的需求」，同時打破傳統情趣商品的刻板印象。",我們發現，最大的問題在於如何將親密互動更加感性的放入日常生活與大眾文化中。,"它讓你更性感，也創造前所未有的感受！

感官珠寶專注於各種知覺感受，如撫摸、氣味、聲音。它是一種具有紀念價值的智慧穿戴，翻轉了傳統情趣商品一貫的「震動回饋」模式。感官珠寶可以在公開場合優雅地配戴，讓個人或情侶更了解自己身體、展現對身體的自信，也提升在親密經驗之前的前戲品質，讓大眾從不同觀點重新思考、經歷情慾。

單人使用：個人感官探索之旅
透過感官珠寶探索自己的身體情緒，增加情趣與驚喜感。

雙人使用：情侶之間的秘密調情暗號
客製化雙方的專屬密碼，產品將會做出回饋和反應，模擬出特定於兩人之間的觸動頻率。","微思維斯團隊成員有著設計與工程兼具的背景，
願意接受新事物與跨領域的衝擊，
從生活中發現設計的可能性！",什麼是情慾科技？而微思又在做什麼呢？,"情慾科技(SexTech)是一種科技，用來促進和創新人們的親密關係。
微思是以幸福為目標的品牌，開發兩性互動新型態情趣精品，衝破情趣市場的既定產品。親密生活不和諧的伴侶關係，主因通常是不了解自己的需要及被動的配合伴侶。
微思鼓勵使用者認識身體、與自己的感官溝通。 
微思的感官珠寶會是伴侶的嶄新選擇。",http://www.wisp.me.uk/,https://www.facebook.com/wispme2016,否，僅部分成員同意公開。,Wan Tseng,打雜兼創辦人,路娟,設計研究員,偉祐,硬體工程師,政琳,助理工程師,徐則,工業設計師,Chien Han,工程統籌,https://drive.google.com/drive/folders/0B6iUdEHy8XZKY0xMd0FaZFUzc00?usp=sharing,sl,sl_05,官方網站,粉絲專頁
2017/2/16 上午 8:03:48,Cowabunga,"讓每位迎接新生命的父母，
專心喜悅就好，
其他的我們來想辦法",新生兒照護的每個環節皆不容閃失，本著對孩子的愛，父母總是竭力犧牲奉獻，但結果未必如意。現今網絡上又有太多資訊，關於照護方法就有許多完全相悖的理論，偏偏育兒就是這麼感性的事誰也說不準，所以才難斷家務事，但幸好，關於寶寶營養及良好飲食習慣養成早有科學客觀的標準，Ogre將讓它具體實現。,我們發現，真正的問題在於新生兒父母們沒有經驗，更沒有專業知識協助餵養寶寶。,Ogre提供經營養師設計、醫生認證之副食品產品，除了營養均衡外更能協助寶寶逐步建立良好飲食習慣進一步克服過敏。不同於市售冷凍產品，轉而採用成本更高之冷凍乾燥製作，避免配送過程溫度變化造成影響，也讓父母可以自由將產品帶出門，不必受限場地使用。,"團隊由企管人父、行銷未婚男、單身工設男三人組成。
我們年近30，體力還未下坡而經驗已上坡許久，正好！",我們想改變什麼？,我們想用新的方法、製程，製作出更好更符合新生兒飲食需求的產品，讓父母可以輕鬆、放心的專心享受育兒，減少煩惱；讓孩子可以在奠基期培養出更健康的體質。,,,是，全部成員皆同意公開。,王予我,感性人夫,賴根汎,理性未婚男,黃瑞閔,美感單身男,,,,,,,,sl,sl_55,,
,Visual Force,"Sense the unseen, a game for ALL","「如果我能看得見……。」蕭煌奇⟪你是我的眼⟫是膾炙人口的歌曲，輕易就能在心裡唱起一腔波瀾。然而視障者最真實的想望，又有多少人能夠真切地感受？

王小明（化名）是就讀於台北啟明學校的重度視障男孩。儘管體育室裡的歐洲進口滾球造價不斐，他總是無法像輕度視障同學那樣，平穩而快速地讓球在桌面滾動。學校的體育課不是他最期待的課程之一。腳底那雙球鞋卻還不安地躁動著。

是的，有了VisualForce相伴，生命也許不會完全不同。但我們深信，透過VisualForce之眼，創意與歡笑奔放的世界就在我們眼前。",我們發現，真正的問題在於大多視障者運動，不夠刺激。少數刺激好玩者，卻往往不易取得場地。,"我們想幫助視障者建立自信與有尊嚴的生活。運動是好的開始：一個簡單、好玩且互動性高的運動，能夠讓人快速上手，培養興趣與成就感。

反覆的思忖以後，靈光乍現。「光劍」就是這麼一個有話題性、刺激而互動性十足的遊戲。答案一直都在那裡。

揮劍搏鬥，這項獨特才華出現在每個在公園裡玩耍過的小孩的成長歷程裡，與扮家家酒有同樣深遠的軌跡。A game for ALL恰恰就是這個遊戲裡最特別的地方。透過我們改良的輔具，將視覺訊號轉換為觸覺訊號，玩家藉以辨識。考驗的是觸覺與反應的靈敏度。如此一來，視障者與非視障者可以同台競爭，所有人都能在這個遊戲恰如其分地扮演角色，享受揮擊光劍的刺激快感。",成員跨足電機、牙醫、法律、財金、工管。充滿理想的一群人。,參賽初衷？,得之於人者眾。希望貢獻所學，做一盞黑夜的燈，照亮自己與他人。,,,,,,,,,,,,,,,,,hc,hc_09,,